{
  "schema_version": "image-fit-qr-api.v1",
  "request": {
    "request_id": "l2req-demo-0001",
    "destination": {
      "kind": "url",
      "normalized_url": "https://example.com/products/summer-collection?source=printed-menu",
      "display_url": "https://example.com/products/summer-collection?...",
      "safety": {
        "verdict": "pass",
        "policy_version": "destination-safety-v1"
      }
    },
    "target_image": {
      "image_ref": "docs/program/evidence/level2-image-fit-qr-spike/creator-visual-pass/fixtures/bold-diamond.png",
      "mime_type": "image/png",
      "width_px": 128,
      "height_px": 128,
      "sha256": "8cc54ea4a15b165eb5f9092722cff1b89cf47eff86e295fc129beb590df1a49b",
      "complexity": "simple_mark"
    },
    "user_controls": {
      "treatment": "pixel_blend",
      "strength": "balanced",
      "detail": "detailed",
      "link_mode": "optimized_short_link"
    },
    "constraints": {
      "max_candidates": 12,
      "max_search_ms": 45000,
      "allowed_ecc": [
        "Q",
        "H"
      ],
      "allowed_masks": [
        0,
        1,
        2,
        3,
        4,
        5,
        6,
        7
      ],
      "allowed_versions": [
        8,
        9,
        10,
        11,
        12
      ]
    },
    "entitlement_context": {
      "mode": "preview",
      "export_entitled": false
    }
  },
  "candidates": [
    {
      "candidate_id": "readable-767dfb22f336e040c704",
      "mode": "readable",
      "status": "validated",
      "qr_settings": {
        "payload_mode": "optimized_short_link",
        "short_link": {
          "slug": "bD7xQ2",
          "state": "reserved",
          "route": "/r/bD7xQ2"
        },
        "encoded_payload_display": "https://placeholder-online.com/r/bD7xQ2",
        "payload_sha256": "0b9d3c08679190dc700907affabb5257b049d4cf154027168e366bed74571d7d",
        "version": 8,
        "module_count": 49,
        "ecc": "H",
        "mask": 3
      },
      "image_treatment": {
        "kind": "background_silhouette",
        "modified_modules": 300,
        "modified_fraction": 0.124948,
        "luminance_policy_version": "image-fit-luma-v1-dark<=64-light>=218",
        "color_profile": "srgb"
      },
      "protected_regions": {
        "quiet_zone": true,
        "finder": true,
        "separator": true,
        "timing": true,
        "alignment": true,
        "format": true,
        "version_info": true,
        "immutable_modules_policy_version": "qr-functional-regions-v2-alignment",
        "violations": []
      },
      "scan_evidence": {
        "verdict": "pass",
        "decoder_suite_version": "scan-v1-real-75pct",
        "checks_passed": 8,
        "checks_total": 8,
        "decoders": [
          {
            "name": "jsQR",
            "version": "1.4.0",
            "pass": true
          }
        ],
        "physical_scan": "not_performed",
        "print_scan": "not_performed",
        "disclaimer": "Controlled decoder checks are not a universal scan guarantee. No physical-device or print scan was performed."
      },
      "image_fit_evidence": {
        "fit_label": "readable",
        "score_version": "image-fit-target-coverage-v1",
        "recognition_score": 0.449775,
        "protected_zone_conflict_score": 0.121439
      },
      "export_authority": {
        "export_allowed": false,
        "blockers": [
          "preview_not_paid",
          "short_link_not_committed"
        ],
        "requires_payment_or_internal_entitlement": true,
        "preview_export_parity": "proven"
      },
      "artifacts": [
        {
          "kind": "export_svg",
          "uri": "docs/program/evidence/level2-production-image-fit-core/artifacts/readable.svg",
          "sha256": "23c9c86e554be9ad57ccafb19953064471d5cb14b091112044e6e1f0bd62f440"
        }
      ],
      "warnings": []
    },
    {
      "candidate_id": "balanced-38d1d42054e297be0a9a",
      "mode": "balanced",
      "status": "validated",
      "qr_settings": {
        "payload_mode": "optimized_short_link",
        "short_link": {
          "slug": "bD7xQ2",
          "state": "reserved",
          "route": "/r/bD7xQ2"
        },
        "encoded_payload_display": "https://placeholder-online.com/r/bD7xQ2",
        "payload_sha256": "0b9d3c08679190dc700907affabb5257b049d4cf154027168e366bed74571d7d",
        "version": 10,
        "module_count": 57,
        "ecc": "Q",
        "mask": 1
      },
      "image_treatment": {
        "kind": "module_recolor",
        "modified_modules": 819,
        "modified_fraction": 0.252078,
        "luminance_policy_version": "image-fit-luma-v1-dark<=64-light>=218",
        "color_profile": "srgb"
      },
      "protected_regions": {
        "quiet_zone": true,
        "finder": true,
        "separator": true,
        "timing": true,
        "alignment": true,
        "format": true,
        "version_info": true,
        "immutable_modules_policy_version": "qr-functional-regions-v2-alignment",
        "violations": []
      },
      "scan_evidence": {
        "verdict": "pass",
        "decoder_suite_version": "scan-v1-real-75pct",
        "checks_passed": 8,
        "checks_total": 8,
        "decoders": [
          {
            "name": "jsQR",
            "version": "1.4.0",
            "pass": true
          }
        ],
        "physical_scan": "not_performed",
        "print_scan": "not_performed",
        "disclaimer": "Controlled decoder checks are not a universal scan guarantee. No physical-device or print scan was performed."
      },
      "image_fit_evidence": {
        "fit_label": "balanced",
        "score_version": "image-fit-target-coverage-v1",
        "recognition_score": 0.914063,
        "protected_zone_conflict_score": 0.085938
      },
      "export_authority": {
        "export_allowed": false,
        "blockers": [
          "preview_not_paid",
          "short_link_not_committed"
        ],
        "requires_payment_or_internal_entitlement": true,
        "preview_export_parity": "proven"
      },
      "artifacts": [
        {
          "kind": "export_svg",
          "uri": "docs/program/evidence/level2-production-image-fit-core/artifacts/balanced.svg",
          "sha256": "254746f6e441dc7ed2fe1c43029c825030a3e7a0ec8c9242b33d27d9a8c37b98"
        }
      ],
      "warnings": []
    },
    {
      "candidate_id": "image-first-b3d3125d2689d6d28d88",
      "mode": "image_first",
      "status": "experimental",
      "qr_settings": {
        "payload_mode": "optimized_short_link",
        "short_link": {
          "slug": "bD7xQ2",
          "state": "reserved",
          "route": "/r/bD7xQ2"
        },
        "encoded_payload_display": "https://placeholder-online.com/r/bD7xQ2",
        "payload_sha256": "0b9d3c08679190dc700907affabb5257b049d4cf154027168e366bed74571d7d",
        "version": 12,
        "module_count": 65,
        "ecc": "Q",
        "mask": 0
      },
      "image_treatment": {
        "kind": "central_logo_pixel",
        "modified_modules": 1063,
        "modified_fraction": 0.251598,
        "luminance_policy_version": "image-fit-luma-v1-dark<=64-light>=218",
        "color_profile": "srgb"
      },
      "protected_regions": {
        "quiet_zone": true,
        "finder": true,
        "separator": true,
        "timing": true,
        "alignment": true,
        "format": true,
        "version_info": true,
        "immutable_modules_policy_version": "qr-functional-regions-v2-alignment",
        "violations": []
      },
      "scan_evidence": {
        "verdict": "pass",
        "decoder_suite_version": "scan-v1-real-75pct",
        "checks_passed": 8,
        "checks_total": 8,
        "decoders": [
          {
            "name": "jsQR",
            "version": "1.4.0",
            "pass": true
          }
        ],
        "physical_scan": "not_performed",
        "print_scan": "not_performed",
        "disclaimer": "Controlled decoder checks are not a universal scan guarantee. No physical-device or print scan was performed."
      },
      "image_fit_evidence": {
        "fit_label": "experimental",
        "score_version": "image-fit-target-coverage-v1",
        "recognition_score": 0.947415,
        "protected_zone_conflict_score": 0.052585
      },
      "export_authority": {
        "export_allowed": false,
        "blockers": [
          "preview_not_paid",
          "short_link_not_committed",
          "image_first_experimental"
        ],
        "requires_payment_or_internal_entitlement": true,
        "preview_export_parity": "proven"
      },
      "artifacts": [
        {
          "kind": "export_svg",
          "uri": "docs/program/evidence/level2-production-image-fit-core/artifacts/image-first.svg",
          "sha256": "344d8be0a7304b72c87deafa26dbe4bd400ba670d11fa00530ec83bd2e1ee322"
        }
      ],
      "warnings": [
        {
          "code": "image_fit_image_first_experimental",
          "message": "Image-first remains experimental until stricter launch gates and Product Architect promotion.",
          "block_export": true
        }
      ]
    }
  ],
  "selection_policy": {
    "default_mode": "balanced",
    "export_requires_entitlement": true,
    "image_first_default_export_allowed": false
  },
  "fallback": {
    "available": true,
    "kind": "level1_styled_qr",
    "reason": "Deterministic Level 1 artifact is retained as a safe fallback."
  }
}
